{
  "schema_version": "1.1",
  "session_id": "11111111-1111-4111-8111-111111111101",
  "mode": "standalone",
  "host_role": "client",
  "started_at_utc": "2026-10-20T02:30:00Z",
  "timezone_offset_minutes": 540,
  "clock_offset_ms": null,
  "clock_uncertainty_ms": null,
  "profile": {
    "schema_version": "1.1",
    "profile_id": "quick-default",
    "label": "빠른 진단 기본 프로파일",
    "mode": "standalone",
    "selected_features": [
      "tcp_connect",
      "icmp_ping",
      "nic_inventory",
      "route_table",
      "result_json"
    ],
    "capture_approved": false,
    "target": {
      "host": "192.168.10.100",
      "port": 1526,
      "protocol": "TCP"
    },
    "limits": {
      "tcp_timeout_ms": 5000,
      "max_hops": 30,
      "retries": 0,
      "max_concurrent_tcp": 4,
      "capture_duration_secs": 30,
      "capture_max_bytes": 52428800,
      "log_retention_days": 30,
      "ui_updates_per_second": 4
    }
  },
  "evidence": [
    {
      "evidence_id": "ev-socket-001",
      "kind": "SOCKET",
      "artifact_path": "artifacts/measurements.jsonl",
      "synthetic": true
    },
    {
      "evidence_id": "ev-icmp-001",
      "kind": "ICMP",
      "artifact_path": "artifacts/measurements.jsonl",
      "synthetic": true
    },
    {
      "evidence_id": "ev-host-001",
      "kind": "HOST_SNAPSHOT",
      "artifact_path": "artifacts/system_snapshot.json",
      "synthetic": true
    }
  ],
  "feature_results": [
    {
      "feature_id": "tcp_connect",
      "group_id": "G-NET",
      "status": "PASS",
      "classification": "OBSERVED",
      "evidence_ids": [
        "ev-socket-001"
      ],
      "started_at_utc": "2026-10-20T02:30:01Z",
      "ended_at_utc": "2026-10-20T02:30:02Z",
      "duration_ms": 12,
      "error_code": null,
      "limitations": [
        "합성(synthetic) 소켓 연결 성공 기록이며 상위 DB/애플리케이션 인증 성공을 의미하지 않음"
      ],
      "next_checks": [
        "애플리케이션 계층 상태 확인이 필요한 경우 별도 운영 절차 수행"
      ]
    },
    {
      "feature_id": "icmp_ping",
      "group_id": "G-NET",
      "status": "PASS",
      "classification": "OBSERVED",
      "evidence_ids": [
        "ev-icmp-001"
      ],
      "started_at_utc": "2026-10-20T02:30:02Z",
      "ended_at_utc": "2026-10-20T02:30:03Z",
      "duration_ms": 4,
      "error_code": null,
      "limitations": [
        "합성(synthetic) ICMP 응답 픽스처 데이터임"
      ],
      "next_checks": []
    },
    {
      "feature_id": "nic_inventory",
      "group_id": "G-PATH",
      "status": "PASS",
      "classification": "OBSERVED",
      "evidence_ids": [
        "ev-host-001"
      ],
      "started_at_utc": "2026-10-20T02:30:00Z",
      "ended_at_utc": "2026-10-20T02:30:01Z",
      "duration_ms": 8,
      "error_code": null,
      "limitations": [],
      "next_checks": []
    },
    {
      "feature_id": "route_table",
      "group_id": "G-PATH",
      "status": "PASS",
      "classification": "OBSERVED",
      "evidence_ids": [
        "ev-host-001"
      ],
      "started_at_utc": "2026-10-20T02:30:00Z",
      "ended_at_utc": "2026-10-20T02:30:01Z",
      "duration_ms": 6,
      "error_code": null,
      "limitations": [],
      "next_checks": []
    },
    {
      "feature_id": "result_json",
      "group_id": "G-EVID",
      "status": "PASS",
      "classification": "OBSERVED",
      "evidence_ids": [
        "ev-socket-001",
        "ev-icmp-001",
        "ev-host-001"
      ],
      "started_at_utc": "2026-10-20T02:30:03Z",
      "ended_at_utc": "2026-10-20T02:30:03Z",
      "duration_ms": 2,
      "error_code": null,
      "limitations": [],
      "next_checks": []
    }
  ],
  "findings": [
    {
      "classification": "OBSERVED",
      "statement": "합성(synthetic) OS 소켓 측정 기준 대상 192.168.10.100:1526에 대해 TCP 연결 수립(CONNECTED)이 확인됨.",
      "evidence_ids": [
        "ev-socket-001"
      ],
      "confidence": "high",
      "limitations": [
        "본 픽스처는 스키마 검증용 합성(synthetic) 데이터이며 실제 네트워크 측정 결과가 아님",
        "TCP 연결 성공은 Oracle 등 상위 서비스 로그인 성공을 의미하지 않음",
        "패킷 캡처 미선택으로 원시 패킷 프레임은 수집하지 않음"
      ],
      "next_checks": [
        "상위 서비스 응답 지연이나 세션 종료 문제가 있는 경우 양방향 정밀 진단 검토"
      ]
    }
  ],
  "limitations": [
    "본 세션 JSON은 G1 스키마 및 판정 규칙 검증을 위한 합성(synthetic) 픽스처이며 실제 네트워크 송수신을 수행하지 않았음",
    "단독 진단 모드로 원격 호스트 시계 오차(clock_offset_ms)는 측정 대상이 아니므로 null로 기록됨"
  ],
  "resource_metrics": {
    "peak_rss_bytes": null,
    "avg_cpu_percent": null,
    "capture_drops": null
  }
}
